{"$schema":"https://json-schema.org/draft/2020-12/schema","$id":"https://raw.githubusercontent.com/hummbl-dev/hummbl-bibliography/main/schemas/source-registry-v0.1.schema.json","title":"HUMMBL Universal Source Registry v0.1","type":"object","required":["schema_version","registry_id","registry_status","last_reviewed_at","source_families","sources"],"properties":{"schema_version":{"const":"source_registry.v0.1"},"registry_id":{"type":"string"},"registry_status":{"enum":["candidate","validated","promoted_with_scope","retired"]},"last_reviewed_at":{"type":"string","format":"date"},"source_families":{"type":"array","minItems":10},"sources":{"type":"array","minItems":1,"items":{"type":"object","required":["source_id","name","source_family","reference_route_id","canonical_uri","identifier_systems","authority_roles","access_modes","official_api","bulk_access","authentication_required","license_posture","terms_review_status","privacy_class","retention_policy","update_frequency","rate_limit_posture","content_types","adapter_status","validation_status","approved_use_cases","prohibited_uses","owner","last_reviewed_at"]}}},"additionalProperties":false}
