{"schema_version":"source_registry.v0.1","registry_id":"hummbl-universal-source-registry","registry_status":"candidate","last_reviewed_at":"2026-07-11","source_families":[{"id":"web_and_archives","title":"Web and archives","description":"Web and archives source family."},{"id":"scholarly_literature","title":"Scholarly literature","description":"Scholarly literature source family."},{"id":"structured_knowledge_graphs","title":"Structured knowledge graphs","description":"Structured knowledge graphs source family."},{"id":"government_and_public_institutions","title":"Government and public institutions","description":"Government and public institutions source family."},{"id":"books_newspapers_historical","title":"Books, newspapers, and historical corpora","description":"Books, newspapers, and historical corpora source family."},{"id":"software_and_packages","title":"Software and packages","description":"Software and packages source family."},{"id":"scientific_and_ml_datasets","title":"Scientific and ML datasets","description":"Scientific and ML datasets source family."},{"id":"multimedia","title":"Multimedia","description":"Multimedia source family."},{"id":"standards_and_specifications","title":"Standards and specifications","description":"Standards and specifications source family."},{"id":"authorized_private_sources","title":"Authorized private sources","description":"Authorized private sources source family."}],"sources":[{"source_id":"crossref","name":"Crossref","source_family":"scholarly_literature","reference_route_id":"scholarly-crossref","canonical_uri":"https://www.crossref.org/","identifier_systems":["doi"],"authority_roles":["doi_metadata_authority"],"access_modes":["api_retrieval","bounded_bulk_snapshot"],"official_api":{"available":true,"uri":"https://api.crossref.org/"},"bulk_access":{"available":true,"uri":"https://www.crossref.org/documentation/retrieve-metadata/rest-api/"},"authentication_required":"optional","license_posture":"open_metadata","terms_review_status":"partial","privacy_class":"public","retention_policy":"bounded_snapshot_when_permitted","update_frequency":"continuous","rate_limit_posture":{"status":"unreviewed","notes":"Verify current official provider policy before live activation."},"content_types":["metadata"],"adapter_status":"planned","validation_status":"unvalidated","approved_use_cases":[],"prohibited_uses":["Do not claim live conformance or complete coverage from registration alone."],"owner":"hummbl-dev/hummbl-bibliography","last_reviewed_at":"2026-07-11"},{"source_id":"openalex","name":"OpenAlex","source_family":"scholarly_literature","reference_route_id":"scholarly-openalex","canonical_uri":"https://openalex.org/","identifier_systems":["openalex_id","doi","orcid","ror"],"authority_roles":["scholarly_graph_aggregator"],"access_modes":["api_retrieval","bounded_bulk_snapshot"],"official_api":{"available":true,"uri":"https://api.openalex.org/"},"bulk_access":{"available":true,"uri":"https://openalex.org/data-snapshot"},"authentication_required":"optional","license_posture":"open_metadata","terms_review_status":"partial","privacy_class":"public","retention_policy":"bounded_snapshot_when_permitted","update_frequency":"continuous","rate_limit_posture":{"status":"unreviewed","notes":"Verify current official provider policy before live activation."},"content_types":["metadata","citation_graph"],"adapter_status":"planned","validation_status":"unvalidated","approved_use_cases":[],"prohibited_uses":["Do not claim live conformance or complete coverage from registration alone."],"owner":"hummbl-dev/hummbl-bibliography","last_reviewed_at":"2026-07-11"},{"source_id":"pubmed","name":"PubMed","source_family":"scholarly_literature","reference_route_id":"biomedical-pubmed-pmc","canonical_uri":"https://pubmed.ncbi.nlm.nih.gov/","identifier_systems":["pmid","doi"],"authority_roles":["biomedical_index_authority"],"access_modes":["api_retrieval"],"official_api":{"available":true,"uri":"https://eutils.ncbi.nlm.nih.gov/entrez/eutils/"},"bulk_access":{"available":false,"posture":"not_claimed"},"authentication_required":"optional","license_posture":"open_metadata","terms_review_status":"partial","privacy_class":"public","retention_policy":"external_reference_default","update_frequency":"continuous","rate_limit_posture":{"status":"unreviewed","notes":"Verify current official provider policy before live activation."},"content_types":["metadata","abstract"],"adapter_status":"planned","validation_status":"unvalidated","approved_use_cases":[],"prohibited_uses":["Do not claim live conformance or complete coverage from registration alone."],"owner":"hummbl-dev/hummbl-bibliography","last_reviewed_at":"2026-07-11"},{"source_id":"pubmed-central","name":"PubMed Central","source_family":"scholarly_literature","reference_route_id":"biomedical-pubmed-pmc","canonical_uri":"https://pmc.ncbi.nlm.nih.gov/","identifier_systems":["pmcid","pmid","doi"],"authority_roles":["biomedical_full_text_archive"],"access_modes":["api_retrieval","bounded_bulk_snapshot"],"official_api":{"available":true,"uri":"https://www.ncbi.nlm.nih.gov/pmc/tools/oai/"},"bulk_access":{"available":true,"uri":"https://www.ncbi.nlm.nih.gov/pmc/tools/ftp/"},"authentication_required":"optional","license_posture":"mixed_by_item","terms_review_status":"partial","privacy_class":"public","retention_policy":"bounded_snapshot_when_permitted","update_frequency":"continuous","rate_limit_posture":{"status":"unreviewed","notes":"Verify current official provider policy before live activation."},"content_types":["full_text","xml"],"adapter_status":"planned","validation_status":"unvalidated","approved_use_cases":[],"prohibited_uses":["Do not claim live conformance or complete coverage from registration alone."],"owner":"hummbl-dev/hummbl-bibliography","last_reviewed_at":"2026-07-11"},{"source_id":"arxiv","name":"arXiv","source_family":"scholarly_literature","reference_route_id":"scholarly-arxiv","canonical_uri":"https://arxiv.org/","identifier_systems":["arxiv_id","doi"],"authority_roles":["preprint_authority"],"access_modes":["api_retrieval","bounded_bulk_snapshot"],"official_api":{"available":true,"uri":"https://export.arxiv.org/api/query"},"bulk_access":{"available":true,"uri":"https://info.arxiv.org/help/bulk_data/index.html"},"authentication_required":"no","license_posture":"mixed_by_item","terms_review_status":"partial","privacy_class":"public","retention_policy":"bounded_snapshot_when_permitted","update_frequency":"continuous","rate_limit_posture":{"status":"unreviewed","notes":"Verify current official provider policy before live activation."},"content_types":["preprint","metadata"],"adapter_status":"planned","validation_status":"unvalidated","approved_use_cases":[],"prohibited_uses":["Do not claim live conformance or complete coverage from registration alone."],"owner":"hummbl-dev/hummbl-bibliography","last_reviewed_at":"2026-07-11"},{"source_id":"github","name":"GitHub","source_family":"software_and_packages","reference_route_id":"software-github","canonical_uri":"https://github.com/","identifier_systems":["git_repository","git_commit","release"],"authority_roles":["software_repository_authority"],"access_modes":["api_retrieval","connector_retrieval","bounded_bulk_snapshot"],"official_api":{"available":true,"uri":"https://api.github.com/"},"bulk_access":{"available":true,"uri":"https://docs.github.com/en/repositories/archiving-a-github-repository/backing-up-a-repository"},"authentication_required":"varies","license_posture":"mixed_by_item","terms_review_status":"partial","privacy_class":"mixed","retention_policy":"bounded_snapshot_when_permitted","update_frequency":"continuous","rate_limit_posture":{"status":"unreviewed","notes":"Verify current official provider policy before live activation."},"content_types":["source_code","issue","pull_request","commit"],"adapter_status":"planned","validation_status":"unvalidated","approved_use_cases":[],"prohibited_uses":["Do not claim live conformance or complete coverage from registration alone."],"owner":"hummbl-dev/hummbl-bibliography","last_reviewed_at":"2026-07-11"},{"source_id":"hugging-face-hub","name":"Hugging Face Hub","source_family":"software_and_packages","reference_route_id":"software-hugging-face","canonical_uri":"https://huggingface.co/","identifier_systems":["hf_repository","git_commit","model_revision","dataset_revision"],"authority_roles":["model_dataset_repository"],"access_modes":["api_retrieval","connector_retrieval","bounded_bulk_snapshot"],"official_api":{"available":true,"uri":"https://huggingface.co/api/"},"bulk_access":{"available":true,"uri":"https://huggingface.co/docs/hub/repositories-getting-started"},"authentication_required":"varies","license_posture":"mixed_by_item","terms_review_status":"partial","privacy_class":"mixed","retention_policy":"bounded_snapshot_when_permitted","update_frequency":"continuous","rate_limit_posture":{"status":"unreviewed","notes":"Verify current official provider policy before live activation."},"content_types":["model","dataset","repository"],"adapter_status":"planned","validation_status":"unvalidated","approved_use_cases":[],"prohibited_uses":["Do not claim live conformance or complete coverage from registration alone."],"owner":"hummbl-dev/hummbl-bibliography","last_reviewed_at":"2026-07-11"},{"source_id":"wikidata","name":"Wikidata","source_family":"structured_knowledge_graphs","reference_route_id":"graph-wikidata","canonical_uri":"https://www.wikidata.org/","identifier_systems":["wikidata_qid","wikidata_pid","statement_guid"],"authority_roles":["entity_graph_aggregator"],"access_modes":["api_retrieval","bounded_bulk_snapshot"],"official_api":{"available":true,"uri":"https://www.wikidata.org/w/api.php"},"bulk_access":{"available":true,"uri":"https://dumps.wikimedia.org/wikidatawiki/entities/"},"authentication_required":"no","license_posture":"open_license","terms_review_status":"partial","privacy_class":"public","retention_policy":"bounded_snapshot_when_p